Термин;Определение
Здание, сооружение или помещение сервисного обслуживания транспортных средств на АЗС;— Здание, сооружение или помещение (мойка и посты технического обслуживания автомобилей), в котором предусматривается выполнение работ по техническому обслуживанию транспортных средств на территории АЗС. п. 3.16 СП 156.13130.2014[21]
Знак безопасности;— Цветографическое изображение определенной геометрической формы с использованием сигнальных и контрастных цветов, графических символов и (или) поясняющих надписей, предназначенное для предупреждения людей о непосредственной или возможной опасности, запрещения, предписания или разрешения определенных действий, а также для информации о расположении объектов и средств, использование которых исключает или снижает воздействие опасных и (или) вредных факторов п. 3.5 ГОСТ Р 12.2.143-2009 [88]
Значимые идентификационные характеристики термического анализа (критерии идентификации);— Характеристики термоаналитических кривых, по которым устанавливается идентичность веществ (материалов) и средств огнезащиты. п. 3.14 ГОСТ Р 53293-2009 [76]
Зона безопасности вертодрома;— Установленная вокруг зоны FATO вертодрома зона безопасности, свободная от препятствий, за исключением необходимых для целей аэронавигации, предназначенная для уменьшения риска повреждения вертолетов при их случайном отклонении за пределы зоны FATO. п. 3.3 СП 135.13130.2012[17]
Зона дыхания;— Пространство радиусом 0,5 м от лица работающего. п. 3.11 СП 60.13330.2012[16]
Зона конечного этапа захода на посадку и взлета (FATO);— Установленная зона, над которой выполняется конечный этап маневра захода на посадку до режима висения или посадки и с которой начинается маневр взлета. п. 3.4 СП 135.13130.2012[17]
Зона контроля пожарной сигнализации (пожарных извещателей);— Совокупность площадей, объемов помещений объекта, появление в которых факторов пожара будет обнаружено пожарными извещателями. п. 3.33 СП 5.13130.2009[7]
Зона огневого воздействия на образец;— Часть образца, расположенная в огневой камере. п. 3.1 ГОСТ 30403-2012 [61]
Зона опасности заражения горючих веществ и материалов работающего генератора (зона пожароопасности генератора);— Значение максимального расстояния по длине струи огнетушащего аэрозоля и/или от корпуса работающего генератора, при котором за счет воздействия высокотемпературных продуктов горения заряда аэрозолеобразующего огнетушащего состава (включая раскаленные твердые и жидкие частицы) и нагретых конструктивных элементов генератора происходит зажигание горючих жидкостей, газов, твердых веществ и материалов. п. 3.15 ГОСТ Р 53284-2009 [42]
Зона пожарного оповещения ;— Часть здания, где проводится одновременное и одинаковое по способу оповещение людей о пожаре. п. 2.3 СП 3.13130.2009[5]
Идентификация продукции;— Установление соответствия конкретной продукции образцу и/или ее описанию. п. 3.1 ГОСТ Р 53293-2009 [76]
Избытки явной теплоты;— Разность тепловых потоков, поступающих в помещение и уходящих из него при расчетных параметрах наружного воздуха (после осуществления технологических и строительных мероприятий по уменьшению теплопоступлений от оборудования, трубопроводов и солнечной радиации) и ассимилируемых воздухом систем вентиляции и кондиционирования. п. 3.13 СП 60.13330.2012[16]
Извещатель пожарный;— Техническое средство, предназначенное для обнаружения факторов пожара и/или формирования сигнала о пожаре. п. 3.4 ГОСТ Р 53325-2012 [50]
Извещатель пожарный (дымовой) аспирационный;— Автоматический ИП, обеспечивающий отбор через систему труб с воздухозаборными отверстиями и доставку проб воздуха (аспирацию) из защищаемого помещения (зоны) к устройству обнаружения признака пожара (дыма, изменения химического состава среды). п. 3.9 ГОСТ Р 53325-2012 [50]
Извещатель пожарный автоматический;— реагирующий на один или несколько факторов пожара. п. 3.5 ГОСТ Р 53325-2012 [50]
Извещатель пожарный автономный;— Автоматический ИП, в корпусе которого конструктивно объединены автономный источник питания и все компоненты, необходимые для обнаружения пожара и непосредственного оповещения о нем. п. 3.6 ГОСТ Р 53325-2012 [50]
Извещатель пожарный адресный;— имеющий индивидуальный присваиваемый адрес, идентифицируемый адресным приемно-контрольным прибором. п. 3.7 ГОСТ Р 53325-2012 [50]
Извещатель пожарный аналоговый;— Автоматический ИП, обеспечивающий передачу на приемно-контрольный прибор информации о текущем значении контролируемого фактора пожара. п. 3.8 ГОСТ Р 53325-2012 [50]
Извещатель пожарный газовый;— Автоматический ИП, реагирующий на изменение химического состава атмосферы, вызванное воздействием пожара. п. 3.10 ГОСТ Р 53325-2012 [50]
Извещатель пожарный газовый, реагирующий на монооксид углерода;— Автоматический ИП, реагирующий на изменение концентрации в атмосфере монооксида углерода (СО), вызванное пожаром. п. 3.63 ГОСТ Р 53325-2012 [50]
Извещатель пожарный дымовой;— Автоматический ИП, реагирующий на частицы твердых или жидких продуктов горения и/или пиролиза в атмосфере. п. 3.11 ГОСТ Р 53325-2012 [50]
Извещатель пожарный дымовой ионизационный;— ИПД, принцип действия которого основан на снижении значения электрического тока, протекающего через ионизированный воздух, при появлении частиц дыма (аэрозоля). п. 3.12 ГОСТ Р 53325-2012 [50]
Извещатель пожарный дымовой оптико-электронный линейный;— ИПД, формирующий оптический луч, проходящий через контролируемую среду вне извещателя, и контролирующий ослабление интенсивности луча средой при ее задымлении. п. 3.13 ГОСТ Р 53325-2012 [50]
Извещатель пожарный дымовой оптико-электронный точечный;— ИПД, реагирующий на продукты горения, способные поглощать, рассеивать или отражать излучение оптического сигнала, чувствительная зона которого расположена в ограниченном объеме, много меньшего объема защищаемого помещения. п. 3.14 ГОСТ Р 53325-2012 [50]
Извещатель пожарный комбинированный;"— Автоматический ИП, реагирующий на два или более физических факторов пожара, с алгоритмом работы по логической схеме ""или"". п. 3.15 ГОСТ Р 53325-2012 [50]"
Извещатель пожарный кумулятивного действия;— линейный или многоточечный ИП, обеспечивающий суммирование значений фактора пожара в контролируемой области. п. 3.16 ГОСТ Р 53325-2012 [50]
Извещатель пожарный мультикритериальный;— Автоматический извещатель пожарный (ИП), контролирующий два или более физических параметров окружающей среды, изменяющихся при пожаре, и обеспечивающий самостоятельно либо во взаимодействии с приемно-контрольным прибором (ППКП) формирование сигнала о пожаре на основании результатов обработки контролируемых данных по заданному алгоритму. п. 3.1 ГОСТ Р 57552-2017 [52]
Извещатель пожарный неадресный;— ИП, не имеющий индивидуального адреса, идентифицируемого приемно-контрольным прибором. п. 3.17 ГОСТ Р 53325-2012 [50]
Извещатель пожарный пламени;— Автоматический ИП, реагирующий на электромагнитное излучение пламени или тлеющего очага. п. 3.18 ГОСТ Р 53325-2012 [50]
Извещатель пожарный пороговый;— Автоматический ПИ, формирующий тревожное извещение при достижении или превышении контролируемым фактором пожара установленного порога. п. 3.19 ГОСТ Р 53325-2012 [50]
Извещатель пожарный радиоканальный;— ИП, осуществляющий обмен информацией с системой пожарной сигнализации по радиоканальной линии связи. п. 3.20 ГОСТ Р 53325-2012 [50]
Извещатель пожарный ручной;— ИП, предназначенный для ручного формирования сигнала пожарной тревоги в шлейфе пожарной сигнализации. п. 3.21 ГОСТ Р 53325-2012 [50]
Извещатель пожарный сателлитный;— Техническое средство, состоящее из автоматического точечного пожарного извещателя и устройства управления спринклерным оросителем с принудительным (управляемым) электропуском. п. 3.21а ГОСТ Р 53325-2012 [50]
Извещатель пожарный тепловой;— Автоматический ИП, реагирующий на значение температуры и/или скорость повышения температуры. п. 3.22 ГОСТ Р 53325-2012 [50]
Извещатель пожарный тепловой дифференциальный;— пороговый ИПТ, формирующий извещение о пожаре при превышении скоростью нарастания температуры окружающей среды установленного порогового значения. п. 3.23 ГОСТ Р 53325-2012 [50]
Извещатель пожарный тепловой линейный;— ИПТ, чувствительный элемент которого расположен на протяжении линии. п. 3.24 ГОСТ Р 53325-2012 [50]
Извещатель пожарный тепловой максимально-дифференциальный;"— ИПТ, выполняющий функции максимального и дифференциального ИПТ (по логической схеме ""ИЛИ"") п. 3.25 ГОСТ Р 53325-2012 [50]"
Извещатель пожарный тепловой максимальный;— пороговый ИПТ, формирующий извещение о пожаре при превышении температуры окружающей среды установленного порогового значения (температуры срабатывания). п. 3.26 ГОСТ Р 53325-2012 [50]
Извещатель пожарный тепловой многоточечный;— ИПТ, чувствительные элементы которого дискретно расположены на протяжении линии. п. 3.27 ГОСТ Р 53325-2012 [50]
Извещатель пожарный тепловой точечный;— ИПТ, в котором устройство обнаружения фактора пожара расположено в ограниченном объеме, много меньшего объема защищаемого помещения.п. 3.28 ГОСТ Р 53325-2012 [50]
Излучающая способность пламени;— Плотность теплового потока очага пожара непосредственно на поверхности пламени при горении материала при пожаре или в условиях специальных испытаний. п. 3.13 ГОСТ 12.1.044-2018 [79]
Изолятор короткого замыкания;— Техническое средство, предназначенное для установки в проводную линию связи, обеспечивающее изоляцию участка линии, в котором произошло короткое замыкание. п. 3.29 ГОСТ Р 53325-2012 [50]
Изотермический пожарный резервуар;— Теплоизолированный сосуд, оборудованный запорно-пусковым устройством, холодильными агрегатами или реконденсатором, приборами управления и контроля, предназначенный для хранения сжиженных газовых огнетушащих веществ при температуре ниже температуры окружающей среды, а также для их подачи. п. 3.1 ГОСТ Р 53282-2009 [40]
Имитатор рабочей нагрузки;— Груз определенной массы, размещаемый на пожарном стволе, при котором токи в электродвигателях или давление рабочего тела в гидро- и пневмоприводах соответствуют номинальному рабочему давлению подачи и номинальному расходу огнетушащего вещества. п. 3.26 ГОСТ Р 53326-2009 [48]
Импульсивное устройство;— устройство, обеспечивающее расчетное давление в трубопроводах спринклерных и подводящих трубопроводах дренчерных установок, необходимое для срабатывания узлов управления. гл. 3 ГОСТ Р 50680-94 [32]
Индекс взрывопожароопасности;— Произведение максимальной скорости нарастания давления взрыва аэровзвеси и характерного размера данного сосуда. п. 3.14 ГОСТ 12.1.044-2018 [79]
Индекс распространения пламени;— Условный безразмерный показатель, характеризующий способность веществ воспламеняться, распространять пламя по поверхности и выделять тепло. п. 3.15 ГОСТ 12.1.044-2018 [79]
Индивидуальная система теплоснабжения;— Система теплоснабжения одноквартирных и блокированных жилых домов, складских, производственных помещений и помещений общественного назначения сельских и городских поселений с расчетной тепловой нагрузкой не более 360 кВт. п. 3.14 СП 60.13330.2012[16]
Индивидуальный пожарный риск;— Пожарный риск, который может привести к гибели человека в результате воздействия опасных факторов пожара. ст. 2 п. 9 ФЗ-123[1]
Индикатор давления;— Показывающее устройство, позволяющее визуально контролировать наличие давления вытесняющего газа. п. 3.14 СП 9.13130.2009[11]
Инерционность (время срабатывания) генератора;— Промежуток времени от момента подачи электрического, теплового или иного сигнала на пуск до начала истечения огнетушащего аэрозоля из выпускного отверстия ГОА. п. 3.1.11 ГОСТ Р 51046-97 [35]
Инерционность (время срабатывания) генератора;— Промежуток времени от момента подачи электрического сигнала на пуск до момента начала истечения струи огнетушащего аэрозоля из выпускного отверстия генератора. п. 3.20 ГОСТ Р 53284-2009 [42]
Инерционность (время срабатывания) модуля (батареи);— Время с момента подачи на модуль (батарею) пускового импульса до момента начала истечения газового огнетушащего вещества. п. 3.12 ГОСТ Р 53281-2009 [39]
Инерционность АУПС;— Время с момента достижения контролируемым фактором пожара порога срабатывания чувствительного элемента до момента начала выхода ОП из модуля (насадка-распылителя). п. 3.1.9 ГОСТ Р 51091-97 [37]
Инерционность запорно-пускового устройства;— Время с момента подачи на запорно-пусковое устройство пускового импульса до момента начала истечения из него огнетушащего вещества. п. 3.7 ГОСТ Р 53282-2009 [40]
Инерционность МУПТВ;— Время с момента достижения контролируемым фактором пожара порога срабатывания чувствительного элемента пожарного извещателя, спринклерного оросителя либо побудительного устройства до начала подачи огнетушащего вещества в защищаемую зону. п. 3.3 ГОСТ Р 53288-2009 [45]
Инерционность распределительного устройства;— Время с момента подачи на устройство пускового импульса до момента начала истечения из него огнетушащего вещества. п. 3.4 ГОСТ Р 53283-2009 [41]
Инерционность распределительного устройства;— Время с момента подачи на устройство пускового импульса до момента полного открытия проходного сечения устройства. п. 3.4 ГОСТ Р 56028-2014 [49]
Инерционность установки пожаротушения;— Время с момента достижения контролируемым фактором пожара порога срабатывания чувствительного элемента пожарного извещателя, спринклерного оросителя либо побудительного устройства до начала подачи огнетушащего вещества в защищаемую зону. п. 3.34 СП 5.13130.2009[7]
Инерционность установки пожаротушения;— Время с момента достижения контролируемым фактором пожара уровня срабатывания чувствительного элемента пожарного извещателя, спринклерного оросителя либо побудительного устройства до начала подачи огнетушащего вещества в защищаемую зону. п. 3.7 ГОСТ Р 50969-96 [33]
Инженерная защита;— Комплекс сооружений, направленных на защиту людей, здания или сооружения, территории, на которой будут осуществляться строительство, реконструкция и эксплуатация здания или сооружения, от воздействия опасных природных процессов и явлений и (или) техногенного воздействия, угроз террористического характера, а также на предупреждение и (или) уменьшение последствий воздействия опасных природных процессов и явлений и (или) техногенного воздействия, угроз террористического характера. ст. 2 п. 7 ГОСТ Р 12.2.143-2009 [2]
Инженерное оборудование зданий;— Система приборов, аппаратов, машин и коммуникаций, обеспечивающая подачу и отвод жидкостей, газов, электроэнергии (водопроводное, газопроводное, отопительное, электрическое, канализационное, вентиляционное оборудование и т.п.). п. 3.19 СП 4.13130.2013[6]
