Термин;Определение
Аварийная вентиляция;— Регулируемый (управляемый) воздухообмен в помещении, обеспечивающий предотвращение увеличения до опасных значений концентраций горючих газов, паров и пыли при их внезапном поступлении в защищаемое помещение. п. 3.1 СП 60.13330.2012[16]
Аварийная ситуация;— Ситуация, характеризующаяся вероятностью возникновения аварии с возможностью дальнейшего ее развития. п. 3.1 СП 12.13130.2009[14]
Аварийная ситуация;— Ситуация, когда произошла авария и возможен дальнейший ход ее развития. п. 3.2 СП 326.1311500.2017 [30]
Аварийный выход;— Дверь, люк или иной выход, которые ведут на путь эвакуации, непосредственно наружу или в безопасную зону, используются как дополнительный выход для спасания людей, но не учитываются при оценке соответствия необходимого количества и размеров эвакуационных путей и эвакуационных выходов и которые удовлетворяют требованиям безопасной эвакуации людей при пожаре. ст. 2 п. 1 ФЗ-123[1]
Аварийный выход;— Дверь, люк или иной выход, которые ведут на путь эвакуации, непосредственно наружу или в безопасную зону, используются как дополнительный выход для спасания людей, но не учитываются при оценке соответствия необходимого числа и размеров эвакуационных путей и эвакуационных выходов, и которые удовлетворяют требованиям безопасной эвакуации людей при пожаре. п. 3.1 ГОСТ Р 12.2.143-2009 [88]
Аварийный пролив топлива;— Топливо, поступившее из оборудования в окружающее пространство в результате аварийной разгерметизации указанного оборудования и/или нарушения требований к эксплуатации АЗС. п. 3.2 СП 156.13130.2014[21]
Аварийный расход газа по трубопроводу;— Расход газа по трубопроводу при аварийной разгерметизации оборудования технологической системы. п. 3.1 СП 156.13130.2014[21]
Авариное освещение;— Освещение на путях эвакуации, имеющее электропитание от автономных источников, функционирующих при пожаре, аварии и других чрезвычайных ситуациях, включаемое автоматически при срабатывании соответствующей сигнализации или вручную, если сигнализации нет или она не сработала. ст. 2 п. 1 ГОСТ Р 12.2.143-2009 [2]
Авария;— Разрушение сооружений и/или технических устройств, применяемых на опасном производственном объекте, неконтролируемый взрыв и/или выброс опасных веществ. п. 3.1 СП 326.1311500.2017 [30]
Авария;— Опасное техногенное происшествие, создающее на объекте, определенной территории или акватории угрозу жизни и здоровью людей и приводящее к разрушению или повреждению зданий, сооружений, оборудования и транспортных средств, нарушению производственного или транспортного процесса, нанесению ущерба окружающей среде. ст. 2 п. 2 ГОСТ Р 12.2.143-2009 [2]
Автоматическая установка аэрозольного пожаротушения;— Установка пожаротушения, использующая аэрозолеобразующие огнетушащие составы, и автоматически срабатывающая при превышении контролируемым фактором (факторами) пожара установленных пороговых значений в защищаемой зоне. п. 3.3 ГОСТ Р 53284-2009 [42]
Автоматическая установка газового пожаротушения;— Совокупность стационарных технических средств для тушения очагов пожара за счет автоматического выпуска газового огнетушащего вещества. п. 3.1 ГОСТ Р 53280.3-2009 [55]
Автоматическая установка газопорошкового пожаротушения ;— Установка пожаротушения, автоматически срабатывающая при превышении контролируемым фактором (факторами) пожара установленных пороговых значений в защищаемой зоне с применением газопорошкового огнетушащего вещества. п. 3.1 СП 155.13130.2014[20]
Автоматическая установка пожаротушения;—Установка пожаротушения, автоматически срабатывающая при превышении контролируемым фактором (факторами) пожара установленных пороговых значений в защищаемой зоне. п. 3.1.1 ГОСТ Р 51091-97 [37]
Автоматическая установка пожаротушения;— Установка пожаротушения, автоматически срабатывающая при превышении контролируемым фактором (факторами) пожара установленных пороговых значений в защищаемой зоне. п. 3.1 ГОСТ Р 53286-2009 [43]
Автоматическая установка пожаротушения (АУП);— Установка пожаротушения, автоматически срабатывающая при превышении контролируемым фактором (факторами) пожара установленных пороговых значений в защищаемой зоне. п. 3.2 СП 5.13130.2009[7]
Автоматическая установка пожаротушения (АУП);— Установка пожаротушения, автоматически срабатывающая при превышении контролируемым фактором (факторами) пожара установленных пороговых значений в защищаемой зоне. п. 3.1 СП 241.1311500.2015 [26]
Автоматический водопитатель;— водопитатель, обеспечивающий расчетный расход и напор для установок водяного и пенного пожаротушения до включения основного водопитателя. гл. 3 ГОСТ Р 50680-94 [32]
Автоматический пожарный извещатель;— Пожарный извещатель, реагирующий на факторы, сопутствующие пожару. п. 3.4 СП 5.13130.2009[7]
Автоматическое управление;— Приведение в действие системы оповещения и управления эвакуацией людей командным сигналом от автоматических установок пожарной сигнализации или пожаротушения. п. 2.1 СП 3.13130.2009[5]
Автомобильная газозаправочная станция с одностенными резервуарами;— Автомобильная газозаправочная станция, технологическая система которой не обеспечивает возможность безопасного перекрытия любой вероятной утечки СУГ или его паров из резервуаров и трубопроводов в окружающую среду, предотвращающего выход за территорию АЗС газопаровоздушных смесей с концентрацией указанных паров более 20% от нижнего концентрационного предела распространения пламени с частотой выше одной миллионной в год. п. 3.3 СП 156.13130.2014[21]
Автомобильная заправочная станция, выполненная как самостоятельный участок АЗС;— АЗС одного вида топлива, технологическая система которой отвечает требованиям к самостоятельному участку многотопливной АЗС с этим видом топлива, а требования к ее размещению, включая размещение зданий и сооружений сервисного обслуживания для водителей, пассажиров и их транспортных средств на территории этой АЗС, аналогичны требованиям к размещению многотопливной АЗС. п. 3.4 СП 156.13130.2014[21]
Автономная установка пожаротушения;— Установка пожаротушения, автоматически осуществляющая функции обнаружения и тушения пожара независимо от внешних источников питания и систем управления. п. 3.5 СП 5.13130.2009[7]
Автономный пожарный извещатель;— Пожарный извещатель, реагирующий на определенный уровень концентрации аэрозольных продуктов горения (пиролиза) веществ и материалов и, возможно, других факторов пожара, в корпусе которого конструктивно объединены автономный источник питания и все компоненты, необходимые для обнаружения пожара и непосредственного оповещения о нем. п. 3.6 СП 5.13130.2009[7]
Авторский надзор;— Контроль лица, осуществившего подготовку проектной документации, за соблюдением в процессе строительства требований проектной документации. ст. 2 п. 3 ГОСТ Р 12.2.143-2009 [2]
Автостоянка (стоянка для автомобилей);— Здание или сооружение (гараж) или их часть, либо специальная открытая площадка, предназначенные для хранения (стоянки) автомобилей. п. 3.1 СП 4.13130.2013[6]
Автостоянка надземного закрытого типа;— Надземная автостоянка с наружными ограждениями. п. 3.2 СП 4.13130.2013[6]
Автостоянка открытого типа;— Автостоянка без наружных стеновых ограждений. Автостоянкой открытого типа считается также такое сооружение, которое открыто, по крайней мере, с двух противоположных сторон наибольшей протяженности. Сторона считается открытой, если общая площадь отверстий, распределенных по стороне, составляет не менее 50% наружной поверхности этой стороны в каждом ярусе (этаже). п. 3.3 СП 4.13130.2013[6]
Автостоянка с пандусами (рампами);— Автостоянки, которые используют ряд постоянно повышающихся (понижающихся) полов или ряд соединительных пандусов между полами, которые позволяют автомашине на своей тяге перемещаться от и на уровень земли. п. 3.4 СП 4.13130.2013[6]
Автостоянка с пандусами (рампами);— Автостоянки, которые используют ряд постоянно повышающихся (понижающихся) полов или ряд соединительных пандусов между полами, которые позволяют автомашине на своей тяге перемещаться с и на уровень земли. п. 3.3 СП 154.13130.2013[19]
Автостоянка с полумеханизированной парковкой;— Автостоянка, в которой транспортировка автомобилей в места хранения осуществляется с участием водителей с использованием специальных механизированных устройств. п. 3.5 СП 154.13130.2013[19]
Автотранспортный тоннель;— Городское подземное (или подводное) линейное сооружение для пропуска автотранспортных средств. п. 3.1 СП 166.1311500.2014[22]
Агрегатная установка пожаротушения;— Установка пожаротушения, в которой технические средства обнаружения пожара, хранения, выпуска и транспортирования огнетушащего вещества конструктивно представляют собой самостоятельные единицы, монтируемые непосредственно на защищаемом объекте. п. 3.7 СП 5.13130.2009[7]
Агрегатная установка пожаротушения ;— Установка пожаротушения, в которой технические средства обнаружения пожара, хранения, выпуска и транспортирования огнетушащего вещества конструктивно представляют собой самостоятельные единицы, монтируемые непосредственно на защищаемом объекте. ГОСТ 12.3.046-91 ССБТ [31]
Адресный пожарный извещатель;— Пожарный извещатель, который передает на адресный приемно-контрольный прибор код своего адреса вместе с извещением о пожаре. п. 3.8 СП 5.13130.2009[7]
Акселератор;— Устройство, обеспечивающее при срабатывании спринклерного оросителя открытие спринклерного воздушного сигнального клапана при незначительном изменении давления воздуха в питающем трубопроводе. п. 3.9 СП 5.13130.2009[7]
Акселератор;— Устройство, обеспечивающее при срабатывании спринклерного оросителя срабатывание спринклерного воздушного сигнального клапана при незначительном изменении давления воздуха в питающем трубопроводе. п. 3.1.14 ГОСТ Р 51052-2002 [36]
Аналитическая идентификация;— Отнесение объекта аналитического контроля или его компонентов к конкретному веществу, материалу, классу веществ или материалов. п. 3.2 ГОСТ Р 53293-2009 [76]
Антипирен;— Вещество, снижающее горючесть древесины и материалов на ее основе. п. 3.2 ГОСТ Р 53292-2009 [75]
Антипирен;— Вещества или смеси, добавляемые в материал (вещество) органического происхождения для снижения его горючести  п. 27 ГОСТ 12.1.033-81 [87]
Антресоль;— площадка в пределах этажа здания, на которой расположены помещения различного назначения или инженерное и технологическое оборудование. п. 3.5 СП 4.13130.2013[6]
Антресоль;— Доступная площадка в объеме двусветного помещения, открытая в это помещение, или расположенная в пределах этажа с повышенной высотой, размером менее 40% площади помещения, в котором она находится. Антресоль не является этажом. п. 3.5 СП 4.13130.2013[6]
Антресоль;— Доступная площадка в объеме двусветного помещения, открытая в это помещение или расположенная в пределах этажа с повышенной высотой, размером менее 40% площади помещения, в котором она находится. Антресоль не является этажом. Атриум, развитый по горизонтали в виде многосветного прохода (при длине более высоты), называется пассажем. п. 3.1 СП 456.1311500.2020[89]
Артиум;— Часть здания в виде многосветного пространства (три и более этажей), развитого по вертикали, смежного с поэтажными частями здания (галереями, ограждающими конструкциями помещений и т.п.), как правило, имеет верхнее освещение. п. 3.2 СП 456.1311500.2020[89]
Атмосфероустойчивое огнезащитное вещество;— Вещество, обеспечивающее в заданных пределах длительную огнезащиту изделий, постоянно находящихся под воздействием атмосферных факторов п. 28 ГОСТ 12.1.033-81 [87]
Атомная станция (АС);— Ядерная установка для производства энергии в заданных режимах и условиях применения, располагающаяся в пределах определенной проектом территории, на которой для осуществления этой цели используется ядерный реактор (реакторы) и комплекс необходимых систем, устройств, оборудования и сооружений с необходимыми работниками (персоналом). п. 2.1 СП 13.13130.2009[15]
АУП высотного стеллажного склада (АУП-ВСС(м));— АУП, смонтированная в высотном стеллажном складе. п. 3.2 СП 241.1311500.2015 [26]
АУП с многоярусным расположением оросителей (АУП-ВСС(м));— АУП, спринклерные оросители которой смонтированы под покрытием помещения и в стеллажах на различных уровнях. п. 3.3 СП 241.1311500.2015 [26]
АУП с одноярусным расположением оросителей (АУП-ВСС(о));— АУП, спринклерные оросители которой смонтированы на одном уровне только под покрытием помещения. п. 3.4 СП 241.1311500.2015 [26]
Аэровзвесь;— Взвешенная в атмосфере окислителя (воздуха) пыль. п. 3.1 ГОСТ 12.1.044-2018 [79]
Аэрозолеобразующий огнетушащий состав;— Специальный состав, способный к самостоятельному горению без доступа воздуха с образованием огнетушащего аэрозоля. п. 3.1.1 ГОСТ Р 51046-97 [35]
Аэрозолеобразующий огнетушащий состав;— Специальный состав, способный к самостоятельному горению без доступа воздуха с образованием огнетушащего аэрозоля. п. 3.6 ГОСТ Р 53284-2009 [42]
Аэрозоль (аэрозольный препарат);— Вещество (включая пропеллент) в аэрозольной упаковке. п. 3.2 ГОСТ 12.1.044-2018 [79]
Аэрозольная упаковка;— Упаковка, имеющая корпус цилиндрической формы, с узкой горловиной, укупориваемой распылительным клапаном, внутри которой сохраняется заданное давление, позволяющее проводить распыление. п. 3.3 ГОСТ 12.1.044-2018 [79]
Аэрозольное пожаротушение;— Совокупность действий и процессов, обеспечивающих тушение пожара, при которых в качестве огнетушащих веществ используют аэрозоли. п. 3.1 ГОСТ Р 53284-2009 [42]
Базовое основание;— Техническое средство, предназначенное для обеспечения крепления, монтажа и коммутации пожарных извещателей и иных технических средств пожарной автоматики. п. 3.1 ГОСТ Р 53325-2012 [50]
Балкон;— Выступающая из плоскости стены площадка. п. 3.6 СП 4.13130.2013[6]
Баллон высокого давления;— Сосуд, имеющий горловину для установки вентиля, фланца или штуцера, предназначенный для хранения и использования сжатых или сжиженных газов. п. 3.1 СП 9.13130.2009[11]
Батарея газового пожаротушения;— Группа модулей газового пожаротушения, объединенных общим коллектором и устройством ручного пуска. п. 3.10 СП 5.13130.2009[7]
Батарея газового пожаротушения;— Группа модулей, объединенных трубопроводным коллектором и устройством ручного пуска, выпускаемая заводом-изготовителем как серийное изделие. п. 3.1 ГОСТ Р 50969-96 [33]
Батарея газового пожаротушения;— Группа модулей, объединенных трубопроводным коллектором и устройством ручного пуска, выпускаемая заводом-изготовителем как серийное изделие. п. 3.2 ГОСТ Р 53281-2009 [39]
Безопасная зона;— Зона, в которой люди защищены от воздействия опасных факторов пожара или в которой опасные факторы пожара отсутствуют либо не превышают предельно допустимых значений. ст. 2 п. 2 ФЗ-123[1]
