Термин;Определение
Огнетушитель;— Переносное или передвижное устройство, предназначенное для тушения очага пожара оператором за счет выпуска огнетушащего вещества, с ручным способом доставки к очагу пожара, приведения в действие и управления струей огнетушащего вещества. п. 3.22 СП 9.13130.2009[11]
Огнетушитель;— Переносное или передвижное устройство, предназначенное для тушения очага пожара за счет выпуска огнетушащего вещества, с ручным способом доставки к очагу пожара, приведения в действие и управления струей огнетушащего вещества. п. 3.5 ГОСТ Р 53280.4-2009 [56]
Огнетушитель заряженный;— Готовый к применению огнетушитель с опломбированным запускающим или запорно-пусковым устройством, содержащий требуемые по техническим условиям заряды огнетушащего вещества и вытесняющего газа. п. 3.6 ГОСТ Р 53280.4-2009 [56]
Огнетушитель комбинированный;— Огнетушитель, представляющий собой комбинацию 2 или более огнетушителей с различными видами ОТВ (порошок + пена, газ + пена и т.д.), которые смонтированы на одной раме. п. 3.25 СП 9.13130.2009[11]
Огнетушитель с  газогенерирующем устройстве;— Огнетушитель, источником вытесняющего газа в котором служит газогенерирующее устройство (ГГУ). п. 3.24 СП 9.13130.2009[11]
Огнетушитель с газовым баллоном ;— Огнетушитель, источником вытесняющего газа в котором служит баллон высокого давления (БВД). п. 3.23 СП 9.13130.2009[11]
Ограждающая стена;— Выполненное из строительных материалов ограждение, предназначенное для ограничения площади разлива жидкости. п. 2.6 ГОСТ Р 53324-2009 [72]
Ограждающая стена с волноотражяющим козырьком;— Выполненное из строительных материалов ограждение, рассчитанное на гидродинамическое воздействие и полное удержание волны жидкости, образующейся при разрушении наземного вертикального резервуара. п. 2.7 ГОСТ Р 53324-2009 [72]
Ограждение;— Естественный барьер, образованный рельефом местности, или искусственное сооружение, ограничивающее участок территории, в пределах которого размещается емкостное оборудование с легковоспламеняющимися и горючими жидкостями, сжиженными углеводородными газами, предназначенное для предотвращения растекания жидкости за пределы этого участка. п. 2.8 ГОСТ Р 53324-2009 [72]
Одиночная прокладка;— Одиночный кабель или ряд кабелей, расстояние по воздуху в свету от которых до ближайшего кабеля превышает 300 мм. п. 3.4 ГОСТ 31565-2012 [86]
Ожидаемый срок службы;— Промежуток времени, обозначенный изготовителем/поставщиком, в течение которого знак безопасности, как ожидается, сохранит свои классифицированные и описанные свойства. п. 3.9 ГОСТ Р 12.2.143-2009 [88]
Окислители;— Вещества и материалы, обладающие способностью вступать в реакцию с горючими веществами, вызывая их горение, а также увеличивать его интенсивность. ст. 2 п. 16 ФЗ-123[1]
Опасные природные процессы и явления;— Землетрясения, сели, оползни, лавины, подтопление территории, ураганы, смерчи, эрозия почвы и иные подобные процессы и явления, оказывающие негативные или разрушительные воздействия на здания и сооружения. ст. 2 п. 12 ГОСТ Р 12.2.143-2009 [2]
Опасные факторы пожара;— Факторы пожара, воздействие которых может привести к травме, отравлению или гибели человека и (или) к материальному ущербу. ст. 2 п. 17 ФЗ-123[1]
Опасный фактор пожара;— Фактор пожара, воздействие которого может привести к травме, отравлению или гибели человека и (или) к материальному ущербу. п. 2.11 СП 13.13130.2009[15]
Опасный фактор пожара;— Фактор пожара, воздействие которого приводит к травме, отравлению или гибели человека, а также к материальному ущербу п. 7 ГОСТ 12.1.033-81 [87]
Оперативная программа управления;— Управляющая программа, формируемая непосредственно на рабочем месте с учетом конкретных факторов пожара (размеров очага горения, вида горючего), направления и дальности подачи огнетушащего вещества. п. 3.20 ГОСТ Р 53326-2009 [48]
Оперативное подразделения пожарной охраны;— Подразделение, созданное для тушения пожаров и проведения связанных с ними аварийно-спасательных работ, размещаемое в здании пожарного депо. п. 2.1 СП 11.13130.2009[13]
Оперативный состав;"— Личный состав подразделения пожарной охраны, деятельность которого направлена на спасение людей и имущества от опасных факторов пожара, ликвидацию пожаров и проведение аварийно-спасательных работ; п. 3.5 СП 232.1311500.2015 [24]"
Оповещатели пожарные индивидуальные;— Оповещатели пожарные, предназначенные для индивидуального оповещения людей о пожаре посредством формирования светового, звукового, речевого, вибрационного или иного воздействия на органы чувств человека. п. 3.1 ГОСТ Р 55149-2012 [51]
Оповещатели пожарные индивидуальные вибрационные;— ОПИ, обеспечивающие оповещение человека о пожаре посредством воздействия вибрации. п. 3.2 ГОСТ Р 55149-2012 [51]
Оповещатели пожарные индивидуальные звуковые;— ОПИ, извещение о пожаре которыми обеспечивается при помощи звуковых сигналов. п. 3.3 ГОСТ Р 55149-2012 [51]
Оповещатели пожарные индивидуальные комбинированные ;— ОПИ, извещение о пожаре которыми обеспечивается при помощи двух и более воздействий. п. 3.4 ГОСТ Р 55149-2012 [51]
Оповещатели пожарные индивидуальные речевые;— ОПИ, извещение о пожаре которыми обеспечивается при помощи речевого сигнала. п. 3.5 ГОСТ Р 55149-2012 [51]
Оповещатели пожарные индивидуальные световые ;— ОПИ, извещение о пожаре которыми обеспечивается при помощи световых сигналов. п. 3.6 ГОСТ Р 55149-2012 [51]
Оповещатели пожарные индивидуальные эклектротоковые;— ОПИ, извещение о пожаре которыми осуществляется воздействием электрического тока. п. 3.7 ГОСТ Р 55149-2012 [51]
Оповещатель пожарно звуковой гидравлический;— Оповещатель, выдающий звуковой неречевой сигнал под действием водяного потока на его гидродвигатель. п. 3.1.19 ГОСТ Р 51052-2002 [36]
Оповещатель пожарный;— Техническое средство, предназначенное для оповещения людей о пожаре посредством подачи светового, звукового, речевого сигнала или иного воздействия на органы чувств человека. п. 3.41 ГОСТ Р 53325-2012 [50]
Оповещатель пожарный звуковой гидравлический;— Оповещатель, выдающий звуковой неречевой сигнал под действием водяного потока на его гидродвигатель. п. 3.6 ГОСТ Р 53287-2009 [44]
Оптимальное качество воздуха;— Состав воздуха в помещении, при котором при длительном и систематическом воздействии на человека обеспечивается комфортное (оптимальное) состояние организма человека. п. 3.15.1 СП 60.13330.2012[16]
Оптическая длинна пути;— Кратчайшее расстояние, которое проходит волновой фронт излучения передатчика от его выходного окна до входного окна приемника. п. 3.39 ГОСТ Р 53325-2012 [50]
Оптическая плотность среды;— Величина, равная десяти десятичным логарифмам отношения мощности потока излучения, прошедшего через незадымленную среду, к мощности потока излучения, ослабленного средой при ее задымлении. п. 3.40 ГОСТ Р 53325-2012 [50]
Опуск;— Распределительный трубопровод ВПВ, по которому вода подается сверху вниз. п. 3.6 СП 10.13130.2009[12]
Организованная, жилая малоэтажная застройка;— Смежные земельные участки, застройка которых осуществляется одним застройщиком в едином архитектурно-композиционном стиле, в соответствии с документацией по планировке территории, разработанной и утвержденной в порядке, установленном Градостроительным кодексом Российской Федерации. п. 3.26 СП 4.13130.2013[6]
Ороситель;— Устройство, предназначенное для тушения, локализации или блокирования пожара путем распыливания воды и (или) водных растворов. п. 3.58 СП 5.13130.2009[7]
Ороситель;— Устройство, предназначенное для тушения, локализации или блокирования пожара путем разбрызгивания или распыления воды и/или водных растворов. п. 3.1.1 ГОСТ Р 51043-2002 [34]
Ороситель;— Устройство, предназначенное для тушения, локализации или блокирования пожара путем распыливания воды и/или водных растворов. п. 3.10 ГОСТ Р 53288-2009 [45]
Ороситель для внутристеллажного пространства;— Ороситель, предназначенный для монтажа во внутристеллажном пространстве стеллажного склада. п. 3.1.12 ГОСТ Р 51043-2002 [34]
Ороситель для водяной завесы;— Ороситель, предназначенный для блокирования пожара путем создания водяных завес. п. 3.1.11 ГОСТ Р 51043-2002 [34]
Ороситель для жилых домов;— Ороситель, предназначенный для тушения пожаров в жилом секторе. п. 3.1.15 ГОСТ Р 51043-2002 [34]
Ороситель для пневмо- и массопроводов;— Ороситель, предназначенный для предотвращения распространения пожара по пневмо- и массокоммуникациям. п. 3.1.13 ГОСТ Р 51043-2002 [34]
Ороситель для подвесных потолков и стеновых панелей;— Ороситель общего назначения, вмонтированный в подвесных потолках или стеновых панелях. п. 3.1.5 ГОСТ Р 51043-2002 [34]
Ороситель для предупреждения взрывов;— Ороситель, предназначенный для предотвращения возникновения взрыва. п. 3.1.14 ГОСТ Р 51043-2002 [34]
Ороситель общего назначения;— Розеточный ороситель традиционной конструкции, устанавливаемый под потолком или на стене и предназначенный для тушения или локализации пожара в зданиях и помещениях различного назначения. п. 3.1.9 ГОСТ Р 51043-2002 [34]
Ороситель с контролем пуска;— Ороситель, обеспечивающий выдачу сигнала о своем срабатывании. п. 3.1.4.1 ГОСТ Р 51043-2002 [34]
Ороситель с контролем состояния;— Спринклерный ороситель, обеспечивающий выдачу в систему управления АУП и (или) в диспетчерский пункт сигнала о срабатывании теплового замка этого оросителя. п. 3.59 СП 5.13130.2009[7]
Ороситель с принудительным пуском;— Ороситель с запорным устройством выходного отверстия, вскрывающимся при подаче внешнего управляющего воздействия (электрического, гидравлического, пневматического, пиротехнического или комбинированного). п. 3.1.4 ГОСТ Р 51043-2002 [34]
Ороситель с управляемым приводом;— Ороситель с запорным устройством выходного отверстия, вскрывающимся при подаче управляющего импульса (электрического, гидравлического, пневматического, пиротехнического или комбинированного). п. 3.60 СП 5.13130.2009[7]
Ороситель специального назначения;— Ороситель, предназначенный для выполнения специальной задачи по тушению, локализации или блокированию распространения пожара. п. 3.1.10 ГОСТ Р 51043-2002 [34]
Освещение накачки;— Время освещения поверхности элементов ФЭС, необходимое для возбуждения фотолюминесцентного свечения. п. 3.10 ГОСТ Р 12.2.143-2009 [88]
Основание здания или сооружения;— Массив грунта, воспринимающий нагрузки и воздействия от здания или сооружения и передающий на здание или сооружение воздействия от природных и техногенных процессов, происходящих в массиве грунта. ст. 2 п. 13 ГОСТ Р 12.2.143-2009 [2]
Основная часть конструкции стены;— Наружная стена, соответствующая требованиям 1.3, перечисление д), без нанесенной на ее внешнюю сторону защитно-декоративной системы. п. 3.2 ГОСТ 31251-2008 [62]
Основной водопитатель;— Водопитатель, обеспечивающий работу установки пожаротушения с расчетным расходом и давлением воды и (или) водного раствора в течение нормируемого времени. п. 3.61 СП 5.13130.2009[7]
Основной водопитатель;— водопитатель, обеспечивающий работу установок водяного и пенного пожаротушения с расчетными расходом и напором в течение нормированного времени работы установки. гл. 3 ГОСТ Р 50680-94 [32]
Основной объем (масса);— Расчетное количество огнетушащего вещества, хранящееся в установке пожаротушения, готовое к немедленному применению в случае возникновения пожара. п. 3.1.3 ГОСТ Р 51091-97 [37]
Основной посадочный этаж;— Этаж главного входа в здание (сооружение). п. 3.2 ГОСТ Р 53296-2009 [63]
Основной продукт;— Содержимое аэрозольной упаковки без пропеллента. п. 3.29 ГОСТ 12.1.044-2018 [79]
Островок безопасности;— Сооружение, предназначенное для защиты установленной на нем топливораздаточной колонки и/или раздаточной колонки от повреждения транспортным средством. п. 3.26 СП 156.13130.2014[21]
Отделка;— Защитно-декоративный слой, предназначенный для нанесения на основную часть стены без воздушного зазора путем оклейки, окраски, напыления, оштукатуривания или любым другим подобным способом. п. 3.6 ГОСТ 31251-2008 [62]
Отделка внешних поверхностей наружных стен;— Внешняя поверхность наружных стен, изготовленная из нештучных (штукатурных, лакокрасочных и т.п.) материалов, предохраняющая основные ограждающие, несущие конструкции и теплоизоляционные материалы от атмосферных и других внешних воздействий. п. 3.9 СП 2.13130.2012[4]
Отказ по общей причине;— Отказы систем (элементов), возникающие вследствие одного отказа или ошибки персонала, или внешнего или внутреннего воздействия, или иной внутренней причины. п. 2.10 СП 13.13130.2009[15]
Отопление;— Искусственное нагревание помещения в холодный период года для компенсации тепловых потерь и поддержания нормируемой температуры со средней необеспеченностью 50 ч/год. п. 3.22 СП 60.13330.2012[16]
Отражатель;— Компонент ИПДЛ, который служит для изменения направления оптического излучения передатчика. п. 3.42 ГОСТ Р 53325-2012 [50]
Отсеченные защитные устройства;— Обжимные муфты из терморасширяющихся материалов, клапаны или иные приспособления, обеспечивающие перекрытие пластмассовых трубопроводов в местах сопряжения с пересекаемыми строительными конструкциями. п. 3.2 ГОСТ Р 53306-2009 [68]
Отступка;— Пространство между наружной поверхностью печи или дымового канала и защищенной или незащищенной от возгорания стеной или перегородкой из горючих или трудногорючих материалов. п. 3.10 СП 7.13130.2013[9]
Охлаждающий элемент;— Композиция или конструкции специального состава, размещаемые в генераторе, которые при теплохимическом взаимодействии с продуктами горения аэрозолеобразующего огнетушащего состава обеспечивают снижение их температуры. п. 3.13 ГОСТ Р 53284-2009 [42]
Охлаждение резервуара мобильными средствами пожаротушения;— Подача воды на орошение резервуара пожарными стволами, присоединяемыми к противопожарному водопроводу высокого давления или с помощью пожарных автомобилей (мотопомп) из пожарных гидрантов или противопожарных емкостей (водоемов). п. 3.6 СП 155.13130.2014[20]
Очаг пожара;— Место первоначального возникновения пожара. ст. 2 п. 18 ФЗ-123[1]
Очаг пожара;— Место первоначального возникновения пожара п. 4 ГОСТ 12.1.033-81 [87]
Очаг пожара модельный;— Очаг пожара установленной формы и размеров. п. 3.16 ГОСТ Р 53286-2009 [43]
Очаг пожара модельный;— Очаг пожара, предназначенный для испытания пожарной техники, формы и размеры которого установлены нормативными документами. п. 3.7 ГОСТ Р 53280.4-2009 [56]
Параметр негерметичности защищаемого помещения;— величина, численно характеризующая негерметичность защищаемого помещения и равная отношению суммарной площади всех постоянно открытых проемов и щелей в защищаемом помещении к объему помещения. п. 3.1.7 ГОСТ Р 51046-97 [35]
