Термин;Определение
Сигнализатор потока жидкости;— Сигнальное устройство, предназначенное для преобразования определенного расхода жидкости в трубопроводе в логический командный импульс. п. 3.1.13 ГОСТ Р 51052-2002 [36]
Сигнализатор потока жидкости (СПЖ);— Пожарный сигнализатор, предназначенный для преобразования определенной величины расхода жидкости в трубопроводе в логический командный импульс. п. 3.90 СП 5.13130.2009[7]
Сигнальная разметка;— Цветографическое изображение с использованием сигнальных и контрастных цветов, нанесенное на поверхности, конструкции, стены, перила, оборудование, машины, механизмы (или их элементы), ленты, цепи, столбики, стойки, заградительные барьеры, щиты и т.п., в целях обозначения опасности, а также для указания и информации. п. 3.17 ГОСТ Р 12.2.143-2009 [88]
Сигнальный клапан;— Нормально закрытое запорное устройство, предназначенное для выдачи командного импульса и пуска огнетушащего вещества при срабатывании оросителя или пожарного извещателя. п. 3.91 СП 5.13130.2009[7]
Сигнальный клапан;— Нормально закрытое запорное устройство, предназначенное для пуска огнетушащего вещества при срабатывании оросителя или пожарного извещателя и выдачи командного импульса. п. 3.1.10 ГОСТ Р 51052-2002 [36]
Система аварийного отключения;— Комплекс технических средств, которые отключают технологическое оборудование при аварии. п. 3.19 СП 326.1311500.2017 [30]
Система автоматического водяного орошения;— Комплекс технических средств подачи воды и пожарной автоматики для осуществления орошения с целью охлаждения объекта защиты при пожаре в автоматическом режиме. п. 3.5 СП 240.1311500.2015 [25]
Система автоматического пенного пожаротушения;— Включает резервуары для воды и пенообразователя, насосную станцию, подводящие растворопроводы с пожарными гидрантами, узлы управления, а также установленные на резервуарах и в зданиях генераторы пены с питающими и распределительными трубопроводами для подачи раствора пенообразователя к этим генераторам, средства автоматизации. п. 3.14 СП 155.13130.2014[20]
Система инженерно-технического обеспечения;— Одна из систем здания или сооружения, предназначенная для выполнения функций водоснабжения, канализации, отопления, вентиляции, кондиционирования воздуха, газоснабжения, электроснабжения, связи, информатизации, диспетчеризации, мусороудаления, вертикального транспорта (лифты, эскалаторы) или функций обеспечения безопасности. ст. 2 п. 21 ГОСТ Р 12.2.143-2009 [2]
Система местных отсосов;— Система местной вытяжной вентиляции, к воздуховодам которой присоединяются местные отсосы. п. 3.33 СП 60.13330.2012[16]
Система объединённого контроля герметичности резервуара ;— Комплекс оборудования, предназначенного для периодического контроля герметичности внешней и постоянного контроля внутренней стенок двустенного (двухоболочечного) резервуара на месте эксплуатации. п. 3.35 СП 156.13130.2014[21]
Система оповещения и управления эвакуацией людей (СОУЭ);— Комплекс организационных мероприятий и технических средств, предназначенный для своевременного сообщения людям информации о возникновении пожара, необходимости эвакуироваться, путях и очередности эвакуации. п. 2.5 СП 3.13130.2009[5]
Система определения координат очага загорания в 3-мерной системе координат;— Система, включающая в себя устройство управления, два и более устройств обнаружения загорания в составе РП, установленных на расстоянии друг от друга, передающих информацию о загорании по каналу связи в устройство управления, которое по полученным данным и расчетным программам формирует информацию о координатах загорания в 3-мерной системе координат для формирования управляющих команд на наведение РП с учетом дальности очага загорания и дальности струй. п. 3.8 ГОСТ Р 53326-2009 [48]
Система передачи извещений о пожаре;— Компонент системы передачи извещений о пожаре, устанавливаемый в промежуточном пункте между объектом и пунктом централизованного наблюдения, и служащий для приема информационных сигналов от приборов объектовых оконечных или других ретрансляторов, их усиления и/или преобразования, с последующей передачей на приборы пультовые оконечные или другие ретрансляторы, а также (при наличии обратного канала) для приема от приборов пультовых оконечных (ретрансляторов) и передачу на приборы объектовые оконечные (ретрансляторы) команд телеуправления управления (при наличии обратного канала). п. 3.54 ГОСТ Р 53325-2012 [50]
Система передачи извещения о пожаре;— Совокупность совместно действующих технических средств, предназначенных для передачи по каналам связи и приема в пункте централизованного наблюдения извещений о пожаре на охраняемом объекте, служебных и контрольно-диагностических извещений, а также (при наличии обратного канала) для передачи и приема команд телеуправления. ст. 2 п. 37 ФЗ-123[1]
Система периодического контроля герметичности резервуара;— Комплекс оборудования, предназначенного для периодического определения персоналом АЗС герметичности резервуаров на месте эксплуатации. п. 3.36 СП 156.13130.2014[21]
Система подслойного тушения пожара в резервуаре;— Комплекс устройств, оборудования и фторсодержащего пленкообразующего пенообразователя, предназначенного для подслойного тушения пожара нефти и нефтепродуктов в резервуаре. п. 3.15 СП 155.13130.2014[20]
Система подслойного тушения пожара в результате;— Комплекс устройств, оборудования и фторсодержащего пленкообразующего пенообразователя, предназначенного для подслойного тушения пожара нефти и нефтепродуктов в резервуаре. п. 3.19 ГОСТ Р 53280.2-2010 [54]
Система пожарной автоматики;— Оборудование, объединенное соединительными линиями и работающее по заданному алгоритму с целью выполнения задач по обеспечению пожарной безопасности на объекте. п. 3.121 СП 5.13130.2009[7]
Система пожарной сигнализации;— Совокупность установок пожарной сигнализации, смонтированных на одном объекте и контролируемых с общего пожарного поста. ст. 2 п. 38 ФЗ-123[1]
Система постоянного контроля герметичности резервуара (межстенного пространства двустенного или двухоболочечного резервуара) и/или трубопровода (межстенного пространства двустенного трубопровода или трубопровода СПГ в футляре)  ;— Комплекс оборудования, предназначенного для раннего обнаружения разгерметизации резервуара (межстенного пространства двустенного или двухоболочечного резервуара) и/или трубопровода (межстенного пространства двустенного трубопровода или трубопровода СПГ в футляре) в автоматическом режиме на месте эксплуатации. п. 3.37 СП 156.13130.2014[21]
Система предотвращения переполнения резервуара ;— Комплекс оборудования, предназначенного для автоматической сигнализации персоналу АЗС о необходимости прекращения операции наполнения резервуара топливом по достижении номинального уровня его наполнения и автоматического прекращения сливо-наливной операции в случае достижения предельного уровня наполнения, указанных в документации на технологическую систему АЗС. п. 3.38 СП 156.13130.2014[21]
Система предотвращения пожара;— Комплекс организационных мероприятий и технических средств, исключающих возможность возникновения пожара на объекте защиты. ст. 2 п. 39 ФЗ-123[1]
Система предотвращения пожара;— Комплекс организационных мероприятий и технических средств, исключающих возможность возникновения пожара на объекте защиты. п. 2.26 СП 13.13130.2009[15]
Система предотвращения пожара;— Комплекс организационных мероприятий и технических средств, направленных на исключение условий возникновения пожара п. 40 ГОСТ 12.1.033-81 [87]
Система противодымной вентиляции вытяжная;— Автоматически и дистанционно управляемая вентиляционная система, предназначенная для удаления продуктов горения при пожаре через дымоприемное устройство наружу. п. 3.16 СП 7.13130.2013[9]
Система противодымной вентиляции приточная;— Автоматически и дистанционно управляемая вентиляционная система, предназначенная для предотвращения при пожаре задымления помещений зон безопасности, лестничных клеток, лифтовых шахт, тамбур-шлюзов посредством подачи наружного воздуха и создания в них избыточного давления, а также для ограничения распространения продуктов горения и возмещения объемов их удаления. п. 3.17 СП 7.13130.2013[9]
Система противодымной защиты;— Комплекс организационных мероприятий, объемно-планировочных решений, инженерных систем и технических средств, направленных на предотвращение или ограничение опасности задымления зданий и сооружений при пожаре, а также воздействия опасных факторов пожара на людей и материальные ценности. ст. 2 п. 40 ФЗ-123[1]
Система противодымной защиты;— Комплекс организационных мероприятий, объемно-планировочных решений, инженерных систем и технических средств, направленных на предотвращение или ограничение опасности задымления зданий, сооружений при пожаре, а также воздействия опасных факторов пожара на людей и материальные ценности. п. 2.20 СП 13.13130.2009[15]
Система противопожарной защиты;— Комплекс организационных мероприятий и технических средств, направленных на защиту людей и имущества от воздействия опасных факторов пожара и (или) ограничение последствий воздействия опасных факторов пожара на объект защиты (продукцию). ст. 2 п. 41 ФЗ-123[1]
Система противопожарной защиты ;— Комплекс организационных мероприятий и технических средств, направленных на защиту людей и имущества от воздействия опасных факторов пожара и (или) ограничение последствий воздействия опасных факторов пожара на объект защиты (продукцию). п. 2.21 СП 13.13130.2009[15]
Система противопожарной защиты;— Совокупность организационных мероприятий и технических средств, направленных на предотвращение воздействия на людей опасных факторов пожара и ограничение материального ущерба от него п. 19 ГОСТ 12.1.033-81 [87]
Система теплоизоляции;— Система из двух и более слоев, используемая для нанесения на стену и содержащая не менее одного слоя, предназначенного для повышения теплотехнических свойств стены. п. 3.4 ГОСТ 31251-2008 [62]
Системы (элементы) безопасности;— Системы (элементы), предназначенные для выполнения функций безопасности. п. 2.23 СП 13.13130.2009[15]
Системы (элементы) нормальной эксплуатации;— Системы (элементы), предназначенные для осуществления нормальной эксплуатации. п. 2.25 СП 13.13130.2009[15]
Системы (элементы), важные для безопасности;— Системы (элементы) безопасности, а также системы (элементы) нормальной эксплуатации, отказы которых нарушают нормальную эксплуатацию АС или препятствуют устранению отклонений от нормальной эксплуатации и могут приводить к проектным и запроектным авариям. п. 2.24 СП 13.13130.2009[15]
Системы внутреннего теплоснабжения здания;— Системы теплоснабжения отопления, водонагревателей, систем горячего водоснабжения, воздухонагревателей приточных установок, кондиционеров, воздушно-отопительных агрегатов, воздушно-тепловых завес и др. п. 3.32 СП 60.13330.2012[16]
Системы противодымной тоннельной вентиляции приточно-вытяжные;"— Автоматически и дистанционно управляемые вентиляционные системы, предназначенные для удаления продуктов горения непосредственно из транспортного отсека тоннеля при возникновении в нем пожара и компенсирующей подачи воздуха в этот отсек с ограничением распространения в нем продуктов горения. В зависимости от принудительного (управляемого) перемещения газовоздушных потоков в защищаемом транспортном отсеке тоннеля приточно-вытяжные системы противодымной тоннельной вентиляции проектируются в соответствии с одной из ниже приведенных схем:  - продольной схеме, при которой механически побуждаемая тяга вентиляторов вытяжных и приточных систем односторонне направлена по нормали к плоскостям проходных сечений транспортного отсека тоннеля (параллельно продольной оси этого отсека);  - поперечной схеме, при которой посредством механически побуждаемой тяги вентиляторов вытяжных и приточных систем осуществляется принудительное перемещение потоков, образующихся при пожаре продуктов горения и воздушных потоков в плоскостях проходных сечений транспортного отсека тоннеля (перпендикулярно продольной оси этого отсека);  - продольно-поперечной схеме, при которой посредством механически побуждаемой тяги вентиляторов вытяжных и приточных систем осуществляется принудительное перемещение потоков, образующихся при пожаре продуктов горения в плоскостях проходных сечений транспортного отсека тоннеля (перпендикулярно продольной оси этого отсека), а воздушных потоков - по нормали к тем же плоскостям (параллельно продольной оси того же отсека) п. 3.21 СП 7.13130.2013[9]"
Сканирование;— Управляемое по определенной программе цикличное движение пожарного ствола. п. 3.23 ГОСТ Р 53326-2009 [48]
Склады нефти и нефтепродуктов;"— Комплекс зданий, резервуаров и других сооружений, предназначенных для приема, хранения и выдачи нефти и нефтепродуктов. К складам нефти и нефтепродуктов относятся: предприятия по обеспечению нефтепродуктами (нефтебазы); резервуарные парки и наливные станции магистральных нефтепроводов и нефтепродуктопроводов; товарно-сырьевые парки центральных пунктов сбора нефтяных месторождений, нефтеперерабатывающих и нефтехимических предприятий; склады нефтепродуктов, входящие в состав промышленных, транспортных, энергетических, сельскохозяйственных, строительных и других предприятий и организаций (расходные склады). п. 3.16 СП 155.13130.2014[20]"
Склады нефти нефтепродуктов;— Комплекс зданий, резервуаров и других сооружений, предназначенных для приема, хранения и выдачи нефти и нефтепродуктов. п. 3.39 СП 4.13130.2013[6]
Скорость нарастания давления взрыва;— Производная давления взрыва при дефлаграционном горении (дефлаграции) на восходящем участке зависимости давления взрыва горючей смеси в замкнутом сосуде от времени. п. 3.37 ГОСТ 12.1.044-2018 [79]
Скрытый ороситель;— Ороситель для подвесных потолков и стеновых панелей, устанавливаемый заподлицо с подвесным потолком или стеной, скрытый термочувствительной декоративной крышкой. п. 3.1.8 ГОСТ Р 51043-2002 [34]
Скрытый ороситель;— Потайной спринклерный ороситель, скрытый декоративной крышкой. п. 3.3 ГОСТ Р 53289-2009 [46]
Слеживаемость;— Процесс, приводящий к слипанию отдельных частиц порошка в большие конгломераты или в сплошной массив. п. 3.11 ГОСТ Р 53280.4-2009 [56]
Сливная колонна;— Устройство для подключения транспортных передвижных заправщиков для слива СПГ из криогенных резервуаров или в криогенные резервуары. п. 3.20 СП 326.1311500.2017 [30]
